George gets a Dodge Charger in 1972, he had it for 30 years, what year is he in?_2002
If you multiply 0.234 by 0.1, what number do you get?_0.0234
What is one eighth as a decimal?_0.125
What does 500,000 mg weigh in kilograms?_0.5_0.5kg_0.5 kg_0.5 kilograms
If each sack can hold 25 kg of soil, how many sacks can be filled from 1,250 kg of soil?_50_50 sacks_50sacks
If the area of a square field is 144 m squared, what is the width of the field?_12_12 m_12m_12 meters
What is 6,004.39 rounded to the nearest 10?_6000
What is 888 rounded to the nearest 100?_900
A car costs £17,898.99. If you are given a discount of 1500, how much will the car cost you?_16398.99
How many pounds is 2,500 pence?_25_£25_25 pounds
What is two-thirds of 81?_54
What is the 3d equivalent of a circle?_sphere_cylinder